,name,user_name,date,content
0,Susan King,@suki50,2020-09-30T20:29:35.000Z,"#JoyceEchaquan was just 37.  She deserved so much better. Her seven children deserved so much better. Long may her memory haunt Quebecers & Canadians and motivate us to finally honour treaties, stop racism & respect the human rights of Indigenous people."
1,Jen The Feisty Librarian,@Feisty_Waters,2020-09-30T22:09:24.000Z,"None of these people alone can make the serious change needed, but together they can bring it to individuals in the municipal, provincial and federal levels who are involved in funding and decision making."
2,Jen The Feisty Librarian,@Feisty_Waters,2020-09-30T22:11:49.000Z,"The intergenerational trauma caused by residential schools, 60s scoop, missing and murdered Indigenous girls and women, foster care system and overall racism is an awful part of Canada’s colonial past and present. It will take all of us settlers to help change the system. (End)"
3,George#VotesBlueAlways,@Numbers28,2020-09-30T18:52:00.000Z,The rich got their largess from the rightward tilt of the political system in this country. Rest of us got screwed. This is the reason why I always say that people are mad at the wrong people. How do we get people who claim to have been forgotten to know their real enemies?
4,George#VotesBlueAlways,@Numbers28,2020-09-30T18:52:01.000Z,"The corrupt, reactionary, racist, xenophobic, pathological lying and far right GOP want to destroy the economic safety net programs that most of us depend on especially after retirement (if we can retire at all) in Social Security and Medicare if we let them. They don't care."
5,charlie // amáyá,@GrandmaSaidNo,2020-09-30T19:04:18.000Z,This wasn’t just a casual racist act. This was murder. The healthcare systems in what is now known as Canada and the US have histories of ignoring and systematically killing Indigenous Peoples.
6,HitBoy Rose,@OmariRose,2020-09-30T22:01:46.000Z,So you comparing yourself too an animal lol
7, Luna's Intuition ,@LunasIntuition,2020-09-30T22:06:16.000Z,"Are we really smarter than animals?The earth was breathing fine before us two legged animals began destroying it.Even with all these racist, homophobics, terrorists out here... How are we not animals?"
8,Buwayahman,@buwayahman,2020-09-30T23:38:08.000Z,It’s crystal clear that Trump is a racist. That’s evident from the debate. What I really cannot understand is how Filipinos in the US continue to support him.  Do they really think of themselves as “white?”
9,Sherry ☭☭,@SherryKDA,2020-09-30T21:27:23.000Z,Did you just call the US a first world country and left out to call Germany one too? And did you also just say that the US has one of the lease problems with racism? That’s pretty delusional ngl
10,Flint Flint,@aflintflint,2020-09-30T20:50:14.000Z,"You want to paint a house yellow. You go to the store. The salesperson offers you a can of red paint. You say you don't want that. He says if you pass on this, your only other choice is ""that""...pointing at another can of red paint. You say that's the same color.He is FURIOUS."
11,Flint Flint,@aflintflint,2020-09-30T23:01:36.000Z,"Absolutely loving the very-not-racist ""you live in a shithole and you're criticizing the US"" responses.I live in a shithole in large part due to the 1980 coup.Which was backed by the US government.Under President Carter, a Democrat.But please do go on."
12,Patty Hajdu,@PattyHajdu,2020-09-30T14:43:22.000Z,This kind of sexism and racism is unacceptable in our society and unacceptable in Canada. Canadians deserve better from Mr. Sloan and Mr. O’Toole.
13,MindOverChatter,@comeragewithme,2020-09-30T19:43:12.000Z,"You have clearly demonstrated you are confused about the term racism. You chose to put Canadians at risk instead of protecting us from being exposed because it was ""racist"" to close our borders to countries with COVID outbreaks."
14,Robby Soave,@robbysoave,2020-09-30T19:13:20.000Z,"Since the thing the Proud Boys want most of all is your attention, gifting them this news cycle feels like a mistake."
15,Charles Williams,@charlesdhmmr,2020-09-30T19:21:05.000Z,"Or maybe it will force us to confront the culture of identity paranoia and endless allegations of ""white supremacy"" and ""racism""."
16,Arash Kolahi,@ArashKolahi,2020-09-30T19:27:06.000Z,"Real democracy means people having a real say in the decisions that affect their lives, but that requires democratic (not top-down, authoritarian & tightly controlled) media to provide unbiased information & a healthy diversity of viewpoints. 7/12"
17,Arash Kolahi,@ArashKolahi,2020-09-30T19:28:31.000Z,"The problems that have led us to this cyclical nightmare are systematic & institutional and thus will require systematic & institutional solutions.Capitalism, authoritarianism, racism, sexism, homophobia, transphobia, imperialism, colonialism… 8/12"
18,New Bolshevik ☭,@Swamp_Maoist,2020-09-30T21:01:35.000Z,"No, there's zero evidence and not even the US state department is alleging there's a /genocide/ in Xinjiang, that's just a far-right, racist talking point."
19,Jose Orquiz,@JoseOrquiz,2020-09-30T18:59:07.000Z,You honestly thought it was a smart reply to type this tweet.  The US needs more diversity training to help counteract the racism and division our country has shown regardless of who held the presidency.
20,Reeba James,@reebajames,2020-09-30T20:40:00.000Z,"No matter what one thinks 45 did or not do last night in condemning white supremacy (he didn’t), the results remain the same: his words empowered a group of known white supremacists."
21,Reeba James,@reebajames,2020-09-30T20:43:31.000Z,"All the people out here trynna prove he isn’t racist, but like... known racists openly support him. I didn’t even know so many white supremacist groups existed in the US, & that’s probs my own ignorance. But you cannot deny that Trump continues to empower and encourage them."
22,yvette nicole brown,@YNB,2020-09-30T22:03:08.000Z,"One day I’m gonna speak on all the racist nonsense I’ve endured in hair & makeup trailers in Hollywood.But until that day, know this: We don’t need more “personals” we NEED systemic change so we don’t have to hire people who can only touch US.#UnMuteNY#WeSeeYou#Everyday"
23,Casey Neistat,@Casey,2020-09-30T17:02:52.000Z,Karen has been around for a long time.
24,Karen Crane,@KarenCraneofCA,2020-09-30T19:32:51.000Z,"Karen is the name of more than one million women in the US, many of them women of color. It's shameful to try to pin something as awful and reprehensible as racism on a personal name. If you insist on doing it, use your own name. Call them Caseys."
25,antinia,@A_Jeter,2020-09-30T20:01:52.000Z,"If you’re a Christian it’s okay to pray & be proactive. You can pray about climate change & recycle, you can pray for the US but remember to be registered & research the candidates, it’s okay to pray for racial healing but you still need to be educated on how to be anti racist."
26,Aki.M,@akiMokoena7,2020-09-30T18:48:29.000Z,"What would be the alternative? Not vote so that VF+ wins? What exactly would my plan be? Somebody is getting elected whether I vote or not! I'd vote DA( I fainted for a few seconds after typing that, I'm still shaking)"
27,Fiso,@Realtsoro1,2020-09-30T19:22:16.000Z,"The problem in the US is thatRepublicans are racist, so all the democrats say to win black votes is ""vote for us we're not racist""But with other groups they have to offer tangible policies/champion their causes to get their voteSo things never improve for black people"
28,Jamison Foser,@jamisonfoser,2020-09-18T23:24:37.000Z,By the way I still can’t find a single @nytimes news report mentioning the fact that twice last weekend Donald Trump endorsed extrajudicial killings.
29,Jamison Foser,@jamisonfoser,2020-09-30T22:13:04.000Z,"It got lost amid the rest of Trump’s volcano of lies and racism last night, but he once endorsed extrajudicial killing — bragging “I sent in the US Marshalls they took care of business” by killing Michael Reinoehl. (background: https://vox.com/2020/9/14/21436216/trump-michael-reinoehl-protests-portland-shooting…)"
30,"James Martin, SJ",@JamesMartinSJ,2020-09-30T21:46:13.000Z,"Also: ""Any kind of social or cultural discrimination in basic personal rights on the grounds of sex, race, color, social conditions, language or religion, must be curbed and eradicated as incompatible with God's design.""  ""Gaudium et Spes,"" Second Vatican Council."
31,"James Martin, SJ",@JamesMartinSJ,2020-09-30T21:46:14.000Z,"""Racism is a sin; a sin that divides the human family, blots out the image of God among specific members of that family, and violates the fundamental human dignity of those called to be children of the same Father.""  ""Brothers and Sisters to Us,"" US Catholic Bishops."
32,J.D. Greear,@jdgreear,2020-09-30T18:51:31.000Z,"When asked to condemn white supremacy, every single one of us should be ready to do so. Racism is, sadly, not extinct, and we know from our Southern Baptist history the effects of the horrific sins of racism and hatred. (1/3)"
33,Office of the Governor of California,@CAgovernor,2020-09-30T22:33:33.000Z,"Governor Newsom signed:#AB3121 establishing task force to study & make proposals on reparations for slavery#AB2542 prohibiting use of race, ethnicity or national origin to seek or obtain convictions or impose sentences#AB3070 aims to eliminate discrimination in jury selection"
34,Office of the Governor of California,@CAgovernor,2020-09-30T22:37:27.000Z,"“As a nation, we can only truly thrive when every one of us has the opportunity to thrive. Our painful history of slavery has evolved into structural racism & bias built into & permeating throughout our democratic & economic institutions.”"
35,Dr. Oni Blackstock,@oni_blackstock,2020-09-30T23:31:27.000Z,"Because #racism leads to #medicalmistrust and labor inequality, Black New Yorkers with #COVID19 were prevented from seeking timely care.There, fixed the title, @Gothamist.Stop blaming Black ppl for being harmed by a system intended to eradicate us."
36,Mother Jones,@MotherJones,2020-09-30T18:51:52.000Z,"Thanks to Trump's trashy performance, last night's debate was unlike any other in US history. @DavidCornDC and @nhbaptiste break down the contrast between Trump and Biden, the racism embedded in the topics, and whether there's any reason to be hopeful."
37,DeMarcus,@semperdiced,2020-09-30T18:24:37.000Z,"Undecided Voter: I mean yeah, Trump’s a racist fascist dictator but Biden isn’t my fave. Lol. I’m so confused. The rest of us:"
38,Grandma Grit ,@grandmagrit,2020-09-30T23:51:05.000Z,I have to admit that Trump did a great job in the debate of showing us all that he's an ignorant racist who knows he's losing so badly that his only hope is that a few fringe White Supremacists will save him from prison.
39,Mark Pukita US Senate Candidate '22 (R-OH),@mpukita,2020-09-30T21:25:09.000Z,"Last night @JoeBiden told us that we're all racist just because we breathe.What a complete and utter fool. An America-hating, corrupt, flip-flopping, wishy-washy, over-the-hill, soulless, fool."
40,Mary Schmich,@MarySchmich,2020-09-30T23:56:31.000Z,"In the midst of the madness, in a country with a proudly racist president, there remain people like Tracy Aiden trying to move us forward. In her case, one kids' book at a time. Today's column."
41,Ava DuVernay,@ava,2020-09-30T03:07:30.000Z,"For those who hadn’t been listening for the past 4 years, Trump just told you that he ain't leaving and that he is a white supremacist. If that doesn't get every American who is not white into overdrive to toss his ass - we may actually deserve what happens next."
42,Marley K,@MarleyK20,2020-09-30T22:22:34.000Z,"White people made this mess. Your messages of urgency should be directed towards White people. You're asking victims to fix messes the perpetrators of crimes against us made. We are trying to survive racism everyday while White folks get to live, their lights just comin on."
43,Ariana Garcia ,@Ariana_noGrande,2020-09-30T19:42:08.000Z,lol at people talking about leaving the US as if racism doesn’t exist in other countries
44,Dave Zirin,@EdgeofSports,2020-09-30T23:48:10.000Z,"Appreciate @KingJames tweeting “PLEASE VOTE” last night. But it’s becoming clear we need a call to not just vote but to defend our vote against racist thugs, a wrecked postal service and Trumpist  judges. The Dems won’t organize that. It’s against their nature. It’ll be up to us."
45,Fr. Bruce Wilkinson,@PadreInAtlanta,2020-09-30T21:52:07.000Z,https://ncronline.org/news/vatican/answering-letter-black-brazilian-clergy-pope-sends-anti-racist-message…The Black Catholic Clergy in the US hope to get Pope Francis to speak to the US hierarchy about their collective silence on the presence of racism in the Church.
46,ballergearca,@BallerGearCA,2020-09-30T18:53:46.000Z,While others #standdownandstandby It's time for us to #StepForward #Standup to #racism & show the world #BlacklivesStillMatter while supporting @ChadGeter_38  #BlackOwnedBusiness#CGBrandhttps://ballergear.ca/collections/cg-brand/products/cg-step-forward-stand-up-to-racism…https://ballergear.ca/collections/cg-brand/products/cg-step-forward-stand-up-to-racism-hoodie…#BallerGear #BlackLivesMatter
47,Connie Walker,@connie_walker,2020-09-30T01:28:01.000Z,"When asked if the way Echaquan was treated was an indication of systemic racism, Premier Legault maintained that it was not.""I really don't think that we have this kind of way of dealing with First Nations in our hospitals. Yes, there is some racism. We're working on that.”"
48,#GenXHippy,@krisikaye5,2020-09-30T19:47:55.000Z,I've been seeing a TON of proof of racism all over Canada against Indigenous people. What is wrong with Canada & the US. We are ALL humans!!
49,LOLGOP,@LOLGOP,2020-09-30T21:04:37.000Z,"REPORTER: I beg you, please don't make us call you a white supremacist.TRUMP: Here's the strategic racism Republicans have been using for decades.REPORTER: Whew!"
50,Kelsey Waits,@KelseyWaitsMN,2020-09-30T19:22:14.000Z,"I condemn white supremacy, but simply saying that is not enough. Each of us most commit to doing the hard work of “anti-racism”. Minnesota has one of the largest racial disparities in the country and we have a lot of work ahead of us. I’m ready to do my part in the MN House."
51,Dujie Tahat,@DujieTahat,2020-09-30T22:40:14.000Z,"The mayor is a conservative in all the ways it matters in Seattle. She wants to fund $100M in vague BIPOC programs by cutting funding to infrastructure projects that would help us transition away from fossil fuels, which disproportionately harm BIPOC. This is regressive & racist."
52, SNOW BUNNY CRISIS ,@AgonyAng,2020-09-30T19:56:05.000Z,I don’t think anyone (Black) is actually under the impression that they can escape racism by leaving the US... people are just looking for even the tiniest bit of relief
53,Al​ 🅖🅓🅐🅓➊ Criswell​,@Gdad1,2020-09-30T21:12:19.000Z,Because Trump is a racist idiot he attacks them. COVID-19 threatens them. But immigrants keep the US fed.
54,Kevin R Burgio PhD,@KRBurgio,2020-09-30T19:11:49.000Z,"It's good for the rest of us to know fraud, harassment, Islamophobia, transphobia, racism, homophobia, and misogyny are met with a tepid non-apology from your department head.This is a Masterclass on the opposite of how to handle a predator working in your department."
55,Lisaisback2,@Lisaisback21,2020-09-30T22:23:44.000Z,Question to my Moat friends-Who are these “Proud Boys” or “ Something Boys” that Trump mentioned that’s making the Left go nuts???
56,Velumon,@lavo323,2020-09-30T22:25:10.000Z,"The proud boys is an organization of libertarian and conservatives focused on preserving the founding fathers principles. Yeah, nothing racist about it. In fact, his head is actually a black man."
57,Taylor Young,@TaylorYoungNews,2020-09-30T19:57:53.000Z,Shout out to all journalists who within the last 6 months have had to immense themselves in education regarding a (1) global pandemic (2) history of racism in the US (3) an unprecedented political climate... all while trying to keep their heads above water mentally and physically
58,Melissa Krzyzanowski,@MrsKrzyz,2020-09-30T19:29:41.000Z,"Lots of deep discussion today. Started with the US debate, which led into Covid, systemic racism, and residential schools. It's hard to watch students walk away feeling defeated when then learn of atrocities, but it's amazing to see what they do once they have the knowledge."
59,Kassie DeFala,@Kassieexx3,2020-09-30T23:59:11.000Z,I love how you have the platform to give a third party candidate like jo Jorgensen a chance but instead you’re giving away nudes to keep us trapped in the two party system that has hosted systemic racism for years. Sad.
60,Brie,@peakednhiskool,2020-09-30T19:30:44.000Z,People like to bring up that “Black people don’t have a stable household with a father and a mother.” I’m stating why the black nuclear family is broken. White privilege is a real thing. It isn’t something white people should deny. White people should be trying to make sure the
61,Brie,@peakednhiskool,2020-09-30T19:30:55.000Z,"privileges that they have expands to minorities in the US. And it starts by actually looking at history with open eyes. Jim Crow laws only officially ended in 1964, but some Jim Crows laws were still in affect till 1968. The effects of centuries of discrimination and racism don’t"
62,TulsaTeresa,@TulsaTeresa,2020-09-30T19:48:00.000Z,"I keep hoping that the election of President Biden will return us to a sense of normalcy, but I will be unable to forget that Trump adherents are racist and that makes me incredibly sad."
63,░𝙽𝚞𝚖𝚋𝚎𝚛 𝚜𝚝𝚊𝚝𝚒𝚘𝚗 𝟷𝟹𝟷𝟸,@nostation206,2020-09-30T19:10:00.000Z,Racism is at the core of so many of our problems that it is actively assisting in the destruction of our planet by acting as a barrier and working backwards against societal progression. Racism holds all of us back - even the ones who currently benefit from it.
64,Seiji - ,@StrangeDogg,2020-09-30T22:26:29.000Z,"Racism is well and alive in Canada as well, it's not just the US. People forget that this country is not a utopia."
65,Anna ,@anna_itsonlyme,2020-09-30T17:06:50.000Z,So Ingrid Seward went on Sky News sharing details about Prince Philip’s thoughts and what he thinks about Harry and Meghan.I’m eagerly waiting for all the royal reporters and commentators raging about him collaborating with a non authorised biography .
66,Erikk_the_Dane™,@Erikk_the_Dane2,2020-09-30T19:25:20.000Z,It's the 21st century. Meghan is a self-made woman who doesn't have to kowtow to anyone esp. those racist & misogynistic vipers in the royal family. The Sussexes made the best decision of their lives when they moved to the US far away from the toxicity on that vile island.
67,Carlo Quicho,@carlos_queso_,2020-09-30T21:16:19.000Z,It’s so unfortunate when I feel like a bunch of us were really rooting for ultra-talent that was @QuinnSimmons9 to represent  on the world stage Who just ended up being racist dickhead lol
68,,@She2cool_,2020-09-30T20:22:42.000Z,"I’m just as racist as Trump I go on white poeple every mf chance I get. They lips small , they have lice , they shaped like chickens, they commit the most suicide, they not mentally strong like us, they hair smell like dog .. should I keep going ??????"
69,Dr. Ravenel Richardson,@RavenelRichard1,2020-09-30T19:19:02.000Z,"Join us for a discussion about how our healthcare systems can address the intersection of three public health crises: racism, COVID-19 and the opioid crisis. Registration is free https://cwru.zoom.us/webinar/register/WN_ohtCRoKNR6qU91unlNGAlw… @KathieKaneW @UREssien @DrMWHooper @CWRUSOM @ADAMHSBoardCC @Siegal_CWRU"
70,Erika Chappell  Maker of Plane Game,@open_sketchbook,2020-09-30T20:16:27.000Z,"jesus christ that story about Joyce Echaquan, and then the premier immediately denying that there's a problem with racism...seriously, fuck this entire stupid country."
71,Erika Chappell  Maker of Plane Game,@open_sketchbook,2020-09-30T20:24:03.000Z,i don't want to hear any fucking canadians being smug about the US right now. their racist system is broken. our racist system is working as fucking intended.
72,Saqib W Ali,@Saqib_W_Ali,2020-09-30T18:47:37.000Z,Canada likes to pretend that they're better than the US with their superior smug complex but eh they still have racism problem and there's the fact that the country was founded on land stolen from Indigenous people.
73,Tradalza Phila (She/Her/Ella),@TraduccionFila,2020-09-30T20:11:23.000Z,"Just mailed thank you cards & handwritten letters to our invaluable #Pennsylvania #voters to let them know how much weight their voices hold this #election. We need every single one of you to #vote If you’re also against injustice, racism, & corruption in the #WH, stand with us!"
74,Joe Biden,@JoeBiden,2020-09-30T01:49:00.000Z,Donald Trump is the worst president we've ever had.
75,Michael Franzese,@MichaelFranzese,2020-09-30T20:50:50.000Z,"Explain the $3.5 million wire to your son from Moscow mayor’s wife who has ties to Putin. You OWE us that?  Explain Burisma.  You OWE us that?  Explain your several racist comments. You OWE us that.  You’re a fraud, Biden.  And we know it."
76,erich kellner,@ErichKellner,2020-09-30T21:43:50.000Z,"#TheFive @TheJuanWilliams The US is the model of diversity, have you lived under a rock? Your side touted ""We are a nation of immigrants"" when defending illegal aliens.Now you claim we are racist? Gimme a break. Name one country more diverse than the US!!!"
77, 𝓒𝓪𝓻𝓪𝓶𝓮𝓵 𝓢𝔀𝓮𝓮𝓽𝓷𝓮𝓼𝓼 ,@Caramel_Angel7,2020-09-30T23:27:13.000Z,#FirstThem why u retweet this when u know #B1 / #FBA isn’t about voting for neither one of those RACIST candidates. They haven’t given us the option to do business with acceptable tangibles. No disrespect to Judge! @FirstThemNEWS@tariqnasheed
78,Shaun Chavis,@ShaunChavis,2020-09-30T23:28:34.000Z,"I've seen so many tweets declaring ""The president of the United States is a racist / white supremacist"" as if it's a shocker for this nation. Have these people forgotten that 15 of the first 18 US presidents owned slaves?"
79,Scott Walker,@swalker3111,2020-09-30T21:24:57.000Z,"Your client was ill prepared and illegally carrying a firearm he was not mature enough to wield.  He might not be a racist, only he can answer that.  But his irresponsibility could endanger us all in the carry community.  It isn’t as much a right as a privilege we must earn"
80,San Diego Loyal,@SanDiegoLoyal,2020-09-30T21:11:17.000Z,No matter the moment.No matter the trash talk.@HackworthMorgan reminds us all there's no place for racist remarks.#BlackLivesMatter
81,Deramin,@otdderamin,2020-09-30T19:18:42.000Z,"I love that at the beginning of the campaign Matt leveraged fantasy racism to color our perceptions and help us buy into the propaganda unthinkingly so he could upend it and really make us question who the ""bad guys"" are. Really shows how he's reflected on his earlier work."
82,Moani,@MoaniAndresen,2020-09-30T21:19:57.000Z,Why are people outside of the US trying to give me their opinions on US politics? Focus on your own country's racism my cuzzie.
83,Julie Ward MEP 2014-2020,@julie4north,2020-09-30T19:12:29.000Z,"Being able to honour our dead, lay them to rest and grieve is important for all of us. But in Turkey racism targeted against Kurds violates the dead#KurdishLivesMatter"
84,Chad Geter,@ChadGeter,2020-09-30T22:45:06.000Z,Weather getting a little chilly? @tlamb9 is still standing with us against racism! Don’t let the cold weather stop you from being the change and challenging racism. Appreciate the support!
85,Mexican American School Boards Association,@MASBATX,2020-09-30T22:33:06.000Z,We're live! Spread the word & join us on the mainstage of the @TASATASB convention for a conversation on school board members' perspectives on #race & #racism with @JARamos_Jr & @TyGJones! #AsiDerechito #SayItLOUD!
86,DG1,@VerdiGg,2020-09-30T23:08:19.000Z,Absolutely! One can understand ransom-held Germany 'pulling' the EU cart in favour of apartheid & racist Israel. But the UK (in 1946) & the US (in 1967) were both 'deliberately' attacked by Israel: how on earth can they still support her to this day?
87,David Benjamin,@DavidManOnFire,2020-09-30T18:36:32.000Z,"Blaming Trump for American racism is TOO EASY. It is ""us.""I would strongly urge you to watchone of the finest commentaries on US racism.--> Eddie Glaude.cc: @esglaude @glennkirschner2@ericgarland @HalSparks@dbishop4152 @bywillpollockhttps://youtu.be/QKiB0APdxToWatch Here"
88,ⓈⒶⓅⓅⒽⒾⓇⒺ,@sapphiresdust,2020-09-30T12:00:24.000Z,I hugged my husband last night and told him I am scared. He hugged me back and said he’ll always protect me.I hate that I’m scared to live in the country I fell in love with.  I hate that the president hates people like me... White supremacy has real consequences. Vote him out.
89,Michelle,@silkie_izzy,2020-09-30T18:41:44.000Z,"Your tweet broke my heart. I’m sorry you’re afraid, we will fix this, we will face the racism that’s ripping us apart finally. Stay strong you aren’t alone, we must all vote. Sending you love and strength"
90,"dr pja, attorney against law",@PJAxemurderer,2020-09-30T19:02:32.000Z,"of every person alive in the US at the start of 2020 one out of every 1,800 have died of coronavirus, this is a tragedyblack americans are 80% more likely to have died than average and almost twice as likely as a white person, this is racism"
