,name,user_name,date,content
91,Tanisha E.,@Tanisha_Ev,2020-09-30T19:05:53.000Z,"Gavin McInnes, who cofounded Vice with a person of Pakistani descent also founded Proud Boys, a racist, misogynistic organization sweeping across the US and Canada. Goes to show, racists are your neighbors, friends, and coworkers."
92,David Lametti,@DavidLametti,2020-09-30T18:49:23.000Z,That includes implementing the United Nations Declaration on the Rights of Indigenous People and passing the legislation declaring a National Day for Truth and Reconciliation.
93,David Lametti,@DavidLametti,2020-09-30T18:49:25.000Z,"It also means taking concrete action to address systemic racism and ensure that justice is delivered fairly for all Canadians. Every child matters. We do not have the power to change our history, but together we can build a better, more just future for us all."
94,Weber State University,@WeberStateU,2020-09-30T19:16:34.000Z,"Join us Thursday and Friday for our 22nd Annual Diversity Conference!The event will be held via Zoom and explore issues surrounding systemic racism and human connections. For more information about the conference and a full calendar of events, visit http://weber.edu/diversity/diversityconference…."
95,Dr. Dina McMillan,@drdina1,2020-09-30T22:33:39.000Z,"Key Tip: Do you know what’s at the root of bias, negative stereotypes, even racism? A perception in our minds of ‘Us’ and ‘Them’. As a natural cognitive process, our brains prioritise ‘Us’. Anything that ramps up those perceptions is going to increase bias as a result. Got it?"
96,Emily Cleffi-Tristani,@EmilyCleffiT,2020-09-30T22:00:27.000Z,"Following last night’s tumultuous debate, Brookings President John R. Allen urges us to focus on three core issues: 1) the threat of emboldened white supremacy, 2) election security & potential for political violence 3) education on structural racism."
97,Sen. Mike Fanning,@FanningforSC,2020-09-30T22:23:02.000Z,“The status quo will never get us where we need to go!” RockHill Mayor John Gettys challenged fired-up crowd 2 “never forget from where we’ve come.” But “continue working together to build a world our children deserve.” Dedication of “No Room for Racism” mural on Rock Hill street
98,Kat Armas,@kat_armas,2020-09-30T19:45:26.000Z,"“Don’t pity us. Just treat us right.”It’s #InternationalPodcastDay and the day after the debate so naturally, I had to drop the second part of my conversation with @thearmchaircomWe talk about anti-racist work as spiritual formation and whole bunch of other  things. Enjoy!"
99," DJ Alma Donatella, B.A. - VISIT AMINAFIT.COM",@TheSydneyA,2020-09-30T18:09:36.000Z,Oh but didn’t Bernie Sanders and Brieyonawa Ja Rule say that a health care system like Canadas would be the only thing I as a Black Woman needed to absolve all the racism ive faced in the US since birth  im confused
100,Georgina (Gigi) Kiersten,@authorgeorginak,2020-09-30T19:25:09.000Z,"There is very few black authors writing black LGBTQ romance full time. I am talking about *minuscule*.  The reason why is bc mainstream LGBTQ romance pub does not give one shit about us, does zero outreach or marketing to us, and are actively racist against us."
101,Christian Christensen,@ChrChristensen,2020-09-30T18:53:38.000Z,"Despite their faux public hand-wringing over Trump, US/Euro media continue to normalize his racist and anti-democratic rhetoric. This time, focusing on the tone of the debates rather than Trump’s embrace of racism and his spreading disinformation about the US electoral system."
102,Stephanie Guerilus,@qsteph,2020-09-30T19:05:02.000Z,"Thank you Ingrid Seward for confirming Old man Phil waves the racist flag for the ""Whites Only"" British Royal Family and expects obedience. Not that most of us needed confirmation but it's good to have it as a matter of public record."
103,Lisa Lucas,@likaluca,2020-09-30T20:52:06.000Z,"Who needs the proud boys he's never heard of when you have law enforcement keeping us in our place? Either way, you are talking about dirty, shameful, racist work."
104,Bailey Steinworth,@baileys,2020-09-30T23:11:08.000Z,Felon disenfranchisement is such a huge form of voter suppression. A lot of countries let people *in prison* vote. Combine that with the racism of the US criminal “justice” system... Anyway if this is news to you read The New Jim Crow by Michelle Alexander.
105,Lily Olsen ,@lilyolsenTO,2020-09-30T22:10:13.000Z,"Looking at everyone who claims we aren’t as bad as the US, and “there’s no racism in Canada”"
106,Benjamin Neel,@DrBenNeel,2020-09-30T21:36:56.000Z,"Let there be no mistake, no uncertainty, no error: the PRESIDENT of the US is an unapologetic racist and white supremacist. Given multiple opportunities to explicitly deny these elemental facts and reject white supremacy, he dodges and demurs. He is what he is and always will be!"
107,David Owens II,@owensd,2020-09-30T20:00:07.000Z,"We didn’t. We were taught that “Nazis were bad” and that “we (the US) were the good guys that won the war”. Schools didn’t teach about the lead up to the war, the societal or economics climate pre-war, etc.Just like how “racism ended” after the civil rights movement."
108,Emily Pothast,@emilypothast,2020-09-30T18:54:49.000Z,Basically everyone left of the far right in the US is engaged in a struggle between the desire to watch an illegitimate empire burn and a desire to prevent the consolidation of what remains of its power in the hands of an openly racist and authoritarian one-party regime.
109, Peter Wallace,@PeterWallaceAU,2020-09-30T21:22:22.000Z,"There has been a significant reduction in overt racism in Australia and the US over the last 50 years, from the 70s to now, to the extent that I once believed we were largely in a post racism era (not so much now). What was the cause of that change? Analysis anyone?"
110,Joshua Collins,@InvisiblesMuros,2020-09-30T23:00:42.000Z,"The government utilizing lies with racist or xenophobic origins to discredit protests is nothing new in the US, nor is trying to incite moral panicRecent refrains of ""Thugs"" ""Looters"" and ""Antif"" are part of a long tradition of such tactics"
111,Prashant Phalpher,@PhalpherMD,2020-09-30T20:08:18.000Z,Big thanks to @DamonTweedyMD for sharing his wisdom and experience on racism in healthcare with us @OslerHealth book club. Great questions and engagement from our staff. Thanks to @DrMohammadOsler for kicking off the discussion and @dr_jhandler for organizing.
112,HawaiiDelilah™,@HawaiiDelilah,2020-09-30T21:34:35.000Z,Thillis is eager to do apologia for the very racist president. North Carolina:  Cal Cunningham will be an upgrade not just for your state but for the entire country.  Please defeat him & do us all a solid.
113,Caoimhe Haughey,@CaoimheHaughey1,2020-09-30T19:46:43.000Z,"Having watched the US Presidential debates 2016 & 2020 (thus far),my view of @POTUS  A misogynist;A perpetrator of abuse; A bully;A bigot;A racist; A boor;A tax cheat; And some adjectives Perfidious;Narcissistic;Bombastic;Ignorant; Untrustworthy;Feel free to add"
114,Hawaii GOP,@gophawaii,2020-09-30T19:27:04.000Z,"""Racist""?Subsidized abortions from the time of Margret Sanger was meant to control population growth of minorities in the US.Since the passage of Roe vs. Wade almost 20,000,000 black American babies have been aborted.That's a genocide of black Americans."
115,Feodor Chin ,@FeoChin,2020-09-30T22:35:59.000Z,"Listen. While you white supremacists stand back and stand by, the rest of us real Americans are gonna stand up and take back our country from you racist sacks of shit.#VOTE #AmericaOrTrump #ShutUpMan #TrumpIsARacist #BidenHarris2020 #Resist"
116,Ronan L Tynan,@RonanLTynan,2020-09-30T23:02:07.000Z,"Who are #Trump’s new best friends the racist Proud Boys? Far Right Neo-Fascist male-only fraternal organization based in  #US with a presence in #Australia, #Canada & #UK actively engaged in violence - refusing to condemn them & all #WhiteSupremacists makes Trump a racist #racism"
117,Megan Ranney MD MPH ,@meganranney,2020-09-30T21:00:26.000Z,"#racism in #healthcare is pervasive & insidious...but imagine, if there were no video evidence, whether it would be revealed. I invite us all to read this article; ponder when & where we have tolerated/been part of the problem; and commit to frank #antiracism in the future."
118,timberwraith,@timberwraith,2020-09-30T18:42:54.000Z,"I just want to remind people that when the chattering class and politicians in the US say ""working class"" they nearly always mean ""white working class"" to the exclusion of everyone else.The same was true for ""middle class"" in the 1990s.Same racist bullshit, different decade."
